{
  "schema": "proveai.theorem-premise-traceability",
  "schema_version": 1,
  "verification_report": "mechanized/results/verification-report.json",
  "paper_source": "paper/main.tex",
  "entries": [
    {
      "id": "R1-Q1-evidence-complete-classifier",
      "claim_class": "core-theorem",
      "boundary": "proved",
      "paper": {
        "anchors": ["sec:contract", "sec:proof", "thm:authorization-to-effect"],
        "claim": "One total durable-evidence classifier prioritizes Commit, conclusive Fail, Unknown after non-conclusive Failure, Retry, and residual Unknown; the stored durable query is exactly equal to replay, and the lost-reply witness preserves distinct zero- and one-effect worlds."
      },
      "formal": {
        "source_files": [
          "mechanized/t1_replay.rs",
          "mechanized/t1_durable_queries.rs",
          "mechanized/k4_terminal_recovery_bridge.rs"
        ],
        "symbols": [
          "evidence_complete_decision",
          "unknown_after_failure",
          "retry_eligible",
          "d_evidence_complete_decision",
          "replay_d_evidence_complete_decision_exact",
          "k4_a3_unknown_effect_cardinality_allowed",
          "k4_a3_lost_reply_indistinguishable_worlds"
        ],
        "premise_symbols": [
          "has_durable_success",
          "failure_conclusive",
          "retry_class_allows_repetition",
          "journal_legal"
        ],
        "conclusion_symbols": [
          "evidence_decision_prioritizes_success",
          "evidence_decision_prioritizes_conclusive_failure",
          "evidence_decision_prioritizes_nonconclusive_failure",
          "evidence_decision_allows_retry_only_after_unknown_guard",
          "replay_d_evidence_complete_decision_exact",
          "k4_a3_lost_reply_indistinguishable_worlds"
        ],
        "premises": [
          "classification uses only replayed durable phase, typed attempt outcomes, retry class, and the configured attempt bound",
          "the Journal prefix is legal when the classifier is consumed by a record guard",
          "the K4 lost-reply witness uses one Uncontrolled Authorize/Prepare/Arm/Start(1) prefix"
        ],
        "conclusions": [
          "durable Success prevents retry and selects Commit",
          "conclusive Failure selects Fail, while a latest non-conclusive Failure selects Unknown before retry eligibility",
          "the durable-state implementation of the classifier equals replay exactly",
          "the same lost-reply prefix classifies Unknown and both the zero-effect and one-effect worlds satisfy k4_a3_unknown_effect_cardinality_allowed while remaining distinct"
        ]
      },
      "evidence": {
        "kind": "verus-target",
        "targets": ["R1", "Q1", "K4-A3"],
        "witnesses": [
          {
            "path": "mechanized/k4_terminal_recovery_bridge.rs",
            "symbols": [
              "k4_a3_unknown_effect_cardinality_allowed",
              "k4_a3_lost_reply_indistinguishable_worlds"
            ]
          }
        ]
      },
      "caveats": [
        "Evidence-complete means complete relative to the durable record language, retry class, and attempt budget; it does not reveal an unpersisted remote linearization or claim epistemic maximality over arbitrary external systems."
      ]
    },
    {
      "id": "T6-D0-primitive-adapter-laws",
      "claim_class": "adapter-interface-theorem",
      "boundary": "proved",
      "paper": {
        "anchors": ["sec:contract", "sec:proof", "thm:authorization-to-effect"],
        "claim": "Successful-result soundness, resolved-failure soundness, and effect boundedness form a reusable primitive adapter interface whose generic composition derives AdapterVerified; the Idempotent, ReadOnly, and Deduplicated packages instantiate that interface."
      },
      "formal": {
        "source_files": [
          "mechanized/t6_terminal_definitions.rs",
          "mechanized/t6_adapter_semantic_closure.rs",
          "mechanized/t6_readonly_operational.rs",
          "mechanized/t6_deduplicated_invariant.rs"
        ],
        "symbols": [
          "adapter_success_sound",
          "adapter_resolved_failure_sound",
          "adapter_effect_bounded",
          "primitive_adapter_laws",
          "primitive_adapter_laws_imply_verified",
          "ensure_member_primitive_adapter_laws",
          "ro_primitive_adapter_laws",
          "dd_primitive_adapter_laws"
        ],
        "premise_symbols": [
          "adapter_rely_trace",
          "commit_outcome_compatible",
          "fail_outcome_compatible",
          "broker_outcome_compatible"
        ],
        "conclusion_symbols": [
          "primitive_adapter_laws_imply_verified",
          "ensure_member_adapter_is_verified",
          "ro_adapter_is_verified",
          "dd_adapter_is_verified"
        ],
        "premises": [
          "a compatible Commit must satisfy result_spec and the class-appropriate zero-effect or one-effect relation",
          "a compatible resolved Fail must satisfy zero_effect",
          "every external run admitted by AdapterRely must satisfy zero_effect or one_effect"
        ],
        "conclusions": [
          "the three primitive laws imply the retained AdapterVerified terminal-refinement interface",
          "the EnsureMember, ReadOnly, and Deduplicated packages derive AdapterVerified through the same generic lemma"
        ]
      },
      "evidence": {
        "kind": "verus-target",
        "targets": ["T6-D0", "T6-A0", "T6-RO0", "T6-DD1"],
        "witnesses": [
          {
            "path": "mechanized/t6_adapter_semantic_closure.rs",
            "symbols": ["ensure_member_primitive_adapter_laws"]
          },
          {
            "path": "mechanized/t6_readonly_operational.rs",
            "symbols": ["ro_primitive_adapter_laws"]
          },
          {
            "path": "mechanized/t6_deduplicated_invariant.rs",
            "symbols": ["dd_primitive_adapter_laws"]
          }
        ]
      },
      "caveats": [
        "The primitive laws make adapter assumptions explicit but do not verify arbitrary production adapters, remote services, or deployment isolation."
      ]
    },
    {
      "id": "T5-R1-durable-success-recovery",
      "claim_class": "core-theorem",
      "boundary": "proved",
      "paper": {
        "anchors": ["sec:proof", "thm:authorization-to-effect"],
        "claim": "Every admitted recovery episode extends committed history monotonically, and every recovery Commit cites a matching successful Outcome already durable at the crash prefix."
      },
      "formal": {
        "source_files": [
          "mechanized/t5_durable_success_recovery.rs",
          "mechanized/t5_commit_recovery.rs"
        ],
        "symbols": [
          "recovery_decision_class_is_complete",
          "recovery_decision_guard_is_sound_and_complete",
          "wal_recovery_decision_composes_with_history",
          "wal_recovery_episode_crash_prefix_provenance",
          "wal_recovery_episode_commit_history_extends",
          "t5_r1_durable_success_recovery",
          "recovery_commit_backed_by_durable_success",
          "recovery_episode"
        ],
        "premise_symbols": [
          "wal_runtime_layer::exec",
          "recovery_episode",
          "recovery_decision_guard_is_sound_and_complete",
          "recovery_commit_backed_by_durable_success"
        ],
        "conclusion_symbols": [
          "recovery_decision_class_is_complete",
          "wal_recovery_episode_has_crash_prefix_provenance",
          "wal_recovery_episode_commit_history_extends",
          "t5_r1_durable_success_recovery"
        ],
        "premises": [
          "wal_runtime_layer::exec(cfg, execution)",
          "t5_r0_layer::recovery_episode(execution.events, crash, finish)",
          "recovery repair is enabled only while mode != Mode::Online",
          "a recovery Commit must match request, attempt, value, and outcome_ref in the crash-prefix durable Journal"
        ],
        "conclusions": [
          "is_prefix(alpha_commit_wal(crash), alpha_commit_wal(finish + 1))",
          "wal_recovery_episode_has_crash_prefix_provenance(execution, crash, finish)",
          "Commit, Fail, Unknown, and NotRecovery are classified exhaustively"
        ]
      },
      "evidence": {
        "kind": "verus-target",
        "targets": ["T5-R1"],
        "witnesses": [
          {
            "path": "mechanized/h2_durable_success_recovery_witness.rs",
            "symbols": ["h2_durable_success_recovery_witness"]
          }
        ]
      },
      "caveats": [
        "The theorem is about the typed WAL model and does not refine byte persistence or the Rust broker."
      ]
    },
    {
      "id": "T6-X0-contextual-protected-effect-composition",
      "claim_class": "generic-protected-effect-theorem",
      "boundary": "conditional-composition",
      "paper": {
        "anchors": ["sec:proof", "thm:authorization-to-effect"],
        "claim": "For any well-formed adapter whose primitive laws derive AdapterVerified, storage context, and plugged WAL execution satisfying the adapter rely relation, the canonical Broker terminal and per-request effect refinement are transported from the WAL execution; complete mediation transports when the coupled projection premise is supplied."
      },
      "formal": {
        "source_files": [
          "mechanized/t6_contextual_end_to_end.rs",
          "mechanized/t6_adapter_executable_refinement.rs",
          "mechanized/t6_terminal_definitions.rs"
        ],
        "symbols": [
          "x0_contextual_terminal_outcome_refines",
          "x0_contextual_broker_terminal_outcome_refines",
          "x0_projection_transports_terminal_refinement",
          "x0_projection_transports_complete_mediation",
          "x0_contextual_per_request_effect_refines",
          "per_request_effect_refinement"
        ],
        "premise_symbols": [
          "storage_parametric_context",